{
  "id": "spectx",
  "name": "SpectX",
  "kind": "studio",
  "categories": [
    "cgi-3d",
    "animation-3d"
  ],
  "description": "Hadera-based 3D product studio founded in 2017 by Barak Vinner, producing photorealistic product animations, exploded views, retail/POSM visualizations, VFX particles and real-time low-poly models for brands and hardware companies.",
  "location": {
    "country": "IL",
    "city": "Hadera"
  },
  "founded": 2017,
  "size": "1-10",
  "status": "active",
  "website": "https://spectx.co.il",
  "links": {
    "linkedin": "https://www.linkedin.com/company/spectx.design/",
    "behance": "https://www.behance.net/spectx",
    "instagram": "https://www.instagram.com/spectx3d/"
  },
  "services": [
    "3D product animation",
    "Photorealistic product visualization",
    "Exploded views",
    "Retail / POSM visualization",
    "Low-poly real-time models"
  ],
  "notable_clients": [
    "Caja Robotics"
  ],
  "key_people": [
    {
      "name": "Barak Vinner",
      "role": "Founder"
    }
  ],
  "tags": [
    "product-viz",
    "freelance-studio"
  ],
  "sources": [
    "https://spectx.co.il",
    "https://www.linkedin.com/company/spectx.design/"
  ],
  "confidence": "high",
  "added": "2026-10-18",
  "last_verified": "2026-10-18"
}
