{
  "id": "hansen-house",
  "name": "Hansen House – Center for Design, Media and Technology",
  "name_he": "בית הנסן",
  "kind": "community",
  "categories": [
    "association",
    "experiential",
    "festival-event"
  ],
  "description": "Restored 19th-century compound in Jerusalem's Talbiyeh run as a center for design, media and technology: exhibitions, sound and audio-visual installations, creator residencies, the Mamuta art and research center, and home of Jerusalem Design Week.",
  "location": {
    "country": "IL",
    "city": "Jerusalem"
  },
  "status": "active",
  "website": "https://hansen.co.il/en/",
  "links": {
    "instagram": "https://www.instagram.com/hansen_house/",
    "facebook": "https://www.facebook.com/hansen.house.1887"
  },
  "services": [
    "Exhibitions & installations",
    "Creator residencies",
    "Mamuta Research Center",
    "Jerusalem Design Week"
  ],
  "tags": [
    "venue",
    "residency",
    "design",
    "media-art"
  ],
  "sources": [
    "https://hansen.co.il/en/",
    "https://2019.jdw.co.il/en/about-jdw/"
  ],
  "confidence": "high",
  "added": "2026-10-19",
  "last_verified": "2026-10-19"
}
