{
  "id": "5ive-ux",
  "name": "5IVE UX",
  "aka": [
    "5IVE Innovation & UX"
  ],
  "kind": "studio",
  "categories": [
    "digital-design"
  ],
  "description": "Israeli UX/UI design agency based in Petah Tikva focusing on complex digital products: B2B SaaS, AI tools, enterprise, medical and defense platforms; offers UX strategy, product design and user research.",
  "location": {
    "country": "IL",
    "city": "Petah Tikva"
  },
  "size": "11-50",
  "status": "active",
  "website": "https://www.5ive.co.il",
  "links": {
    "facebook": "https://www.facebook.com/5ive.ux/",
    "linkedin": "https://www.linkedin.com/company/5ive-innovation-&-ux"
  },
  "services": [
    "UX strategy",
    "product design",
    "user research",
    "UI design"
  ],
  "notable_clients": [
    "Intel",
    "Moovit",
    "Gong",
    "Amdocs",
    "Tenable",
    "Cloudinary",
    "Clalit Health"
  ],
  "sources": [
    "https://www.5ive.co.il",
    "https://clutch.co/il/agencies/ui-ux"
  ],
  "confidence": "high",
  "added": "2026-10-18",
  "last_verified": "2026-10-18"
}
